{
  "SchemaVersion": 1,
  "SetupId": "Company.DeviceSetup",
  "SetupVersion": "1.0.0",
  "Branding": {
    "CompanyName": "YOUR COMPANY",
    "WindowTitle": "Welcome | Device setup",
    "Heading": "Welcome to your new PC",
    "Message": "Please wait while we finish device setup. We are preparing your applications, access, and preferences.",
    "LogoPath": "",
    "BannerPath": "",
    "BannerHeight": 110,
    "LogoMaxWidth": 180,
    "LogoMaxHeight": 48
  },
  "Appearance": {
    "Theme": "Light",
    "AccentColor": "#2563EB",
    "SuccessColor": "#16815D",
    "FailureColor": "#C53F4E",
    "WarningColor": "#A86D0B",
    "WindowWidth": 900,
    "WindowHeight": 820,
    "Topmost": true,
    "ReduceMotion": false,
    "ShowElapsedTime": true,
    "ShowStepNumbers": true,
    "FontFamily": "Segoe UI"
  },
  "Text": {
    "RunningHeading": "Getting things ready",
    "RunningMessage": "Your settings and applications are being prepared.",
    "SuccessHeading": "Your PC is ready",
    "SuccessMessage": "All setup steps have finished. You can start using your device.",
    "WarningHeading": "Ready, with a few things to review",
    "WarningMessage": "Required setup is complete. An optional step needs attention.",
    "FailureHeading": "A few things need attention",
    "FailureMessage": "Review the highlighted steps, then retry or contact your IT service desk.",
    "Footer": "Keep your device plugged in and connected.",
    "Support": "Need help? Contact your IT service desk.",
    "RetryButton": "Retry unfinished",
    "CloseButton": "Done",
    "CopyButton": "Copy details",
    "DetailsLabel": "Setup details"
  },
  "Behavior": {
    "RequireSystemForLive": true,
    "ResumeCompletedSteps": true,
    "StopOnRequiredFailure": false,
    "AllowRetry": true,
    "AutoCloseSuccessSeconds": 0,
    "PollIntervalMilliseconds": 400,
    "StateDirectory": "%ProgramData%/Company/PostEnrollmentSetupUI"
  },
  "Steps": [
    {
      "Id": "step01",
      "Enabled": true,
      "Title": "Device readiness",
      "Description": "Check that the device is ready for final setup.",
      "Script": "Steps/Step-01.ps1",
      "Parameters": {},
      "TimeoutSeconds": 1200,
      "SuccessExitCodes": [
        0,
        3010
      ],
      "RebootExitCodes": [
        3010
      ],
      "Required": true,
      "DependsOn": [],
      "DemoSeconds": 4,
      "DemoFailFirstAttempt": false
    },
    {
      "Id": "step02",
      "Enabled": true,
      "Title": "Business applications",
      "Description": "Install the tools you need for your work.",
      "Script": "Steps/Step-02.ps1",
      "Parameters": {},
      "TimeoutSeconds": 1200,
      "SuccessExitCodes": [
        0,
        3010
      ],
      "RebootExitCodes": [
        3010
      ],
      "Required": true,
      "DependsOn": [],
      "DemoSeconds": 4,
      "DemoFailFirstAttempt": false
    },
    {
      "Id": "step03",
      "Enabled": true,
      "Title": "Company access",
      "Description": "Prepare company connectivity and access.",
      "Script": "Steps/Step-03.ps1",
      "Parameters": {},
      "TimeoutSeconds": 1200,
      "SuccessExitCodes": [
        0,
        3010
      ],
      "RebootExitCodes": [
        3010
      ],
      "Required": true,
      "DependsOn": [],
      "DemoSeconds": 4,
      "DemoFailFirstAttempt": true
    },
    {
      "Id": "step04",
      "Enabled": true,
      "Title": "Device preferences",
      "Description": "Apply your organization's final settings.",
      "Script": "Steps/Step-04.ps1",
      "Parameters": {},
      "TimeoutSeconds": 1200,
      "SuccessExitCodes": [
        0,
        3010
      ],
      "RebootExitCodes": [
        3010
      ],
      "Required": true,
      "DependsOn": [
        "step03"
      ],
      "DemoSeconds": 4,
      "DemoFailFirstAttempt": false
    },
    {
      "Id": "step05",
      "Enabled": true,
      "Title": "Final checks",
      "Description": "Verify the setup and collect diagnostic information.",
      "Script": "Steps/Step-05.ps1",
      "Parameters": {},
      "TimeoutSeconds": 1200,
      "SuccessExitCodes": [
        0,
        3010
      ],
      "RebootExitCodes": [
        3010
      ],
      "Required": false,
      "DependsOn": [],
      "DemoSeconds": 4,
      "DemoFailFirstAttempt": false
    },
    {
      "Id": "step06",
      "Enabled": false,
      "Title": "Additional step 6",
      "Description": "Customize this step for your environment.",
      "Script": "Steps/Step-06.ps1",
      "Parameters": {},
      "TimeoutSeconds": 1200,
      "SuccessExitCodes": [
        0,
        3010
      ],
      "RebootExitCodes": [
        3010
      ],
      "Required": true,
      "DependsOn": [],
      "DemoSeconds": 4,
      "DemoFailFirstAttempt": false
    },
    {
      "Id": "step07",
      "Enabled": false,
      "Title": "Additional step 7",
      "Description": "Customize this step for your environment.",
      "Script": "Steps/Step-07.ps1",
      "Parameters": {},
      "TimeoutSeconds": 1200,
      "SuccessExitCodes": [
        0,
        3010
      ],
      "RebootExitCodes": [
        3010
      ],
      "Required": true,
      "DependsOn": [],
      "DemoSeconds": 4,
      "DemoFailFirstAttempt": false
    },
    {
      "Id": "step08",
      "Enabled": false,
      "Title": "Additional step 8",
      "Description": "Customize this step for your environment.",
      "Script": "Steps/Step-08.ps1",
      "Parameters": {},
      "TimeoutSeconds": 1200,
      "SuccessExitCodes": [
        0,
        3010
      ],
      "RebootExitCodes": [
        3010
      ],
      "Required": true,
      "DependsOn": [],
      "DemoSeconds": 4,
      "DemoFailFirstAttempt": false
    },
    {
      "Id": "step09",
      "Enabled": false,
      "Title": "Additional step 9",
      "Description": "Customize this step for your environment.",
      "Script": "Steps/Step-09.ps1",
      "Parameters": {},
      "TimeoutSeconds": 1200,
      "SuccessExitCodes": [
        0,
        3010
      ],
      "RebootExitCodes": [
        3010
      ],
      "Required": true,
      "DependsOn": [],
      "DemoSeconds": 4,
      "DemoFailFirstAttempt": false
    },
    {
      "Id": "step10",
      "Enabled": false,
      "Title": "Additional step 10",
      "Description": "Customize this step for your environment.",
      "Script": "Steps/Step-10.ps1",
      "Parameters": {},
      "TimeoutSeconds": 1200,
      "SuccessExitCodes": [
        0,
        3010
      ],
      "RebootExitCodes": [
        3010
      ],
      "Required": true,
      "DependsOn": [],
      "DemoSeconds": 4,
      "DemoFailFirstAttempt": false
    }
  ]
}
